{
  "corpus_id": "semantic-conformance-v0.1",
  "groups": [
    {
      "candidate_findings": [
        {
          "detail": "Because tenant_id is not included in the WHERE clause, a request can return records owned by another tenant.",
          "id": "c002",
          "line": 20,
          "path": "src/orders.sql",
          "severity": "bug",
          "title": "Cross-tenant rows can leak"
        }
      ],
      "group_id": "g001",
      "pairs": [
        {
          "candidate_id": "c002",
          "pair_id": "p001",
          "reference_id": "r001"
        }
      ],
      "reference_findings": [
        {
          "detail": "The query no longer restricts rows to the active tenant, exposing other tenants' records.",
          "id": "r001",
          "line": 10,
          "path": "src/orders.sql",
          "severity": "bug",
          "title": "Tenant filter is omitted"
        }
      ],
      "stratum": "equivalent-paraphrase"
    },
    {
      "candidate_findings": [
        {
          "detail": "The loop never consumes the continuation token, so only the first batch of objects is processed.",
          "id": "c004",
          "line": 20,
          "path": "src/storage.ts",
          "severity": "bug",
          "title": "Object traversal is truncated"
        }
      ],
      "group_id": "g002",
      "pairs": [
        {
          "candidate_id": "c004",
          "pair_id": "p002",
          "reference_id": "r003"
        }
      ],
      "reference_findings": [
        {
          "detail": "The storage listing ignores next_page_token and silently drops objects after page one.",
          "id": "r003",
          "line": 10,
          "path": "src/storage.ts",
          "severity": "bug",
          "title": "Pagination stops after the first page"
        }
      ],
      "stratum": "equivalent-paraphrase"
    },
    {
      "candidate_findings": [
        {
          "detail": "setCount(count + 1) runs from a captured render value; a functional update is required to preserve newer increments.",
          "id": "c006",
          "line": 20,
          "path": "src/Counter.tsx",
          "severity": "bug",
          "title": "Timer update uses an obsolete count"
        }
      ],
      "group_id": "g003",
      "pairs": [
        {
          "candidate_id": "c006",
          "pair_id": "p003",
          "reference_id": "r005"
        }
      ],
      "reference_findings": [
        {
          "detail": "The delayed callback captures the old count and loses intervening increments.",
          "id": "r005",
          "line": 10,
          "path": "src/Counter.tsx",
          "severity": "bug",
          "title": "Stale closure overwrites newer state"
        }
      ],
      "stratum": "equivalent-paraphrase"
    },
    {
      "candidate_findings": [
        {
          "detail": "A NULL returned by the NOT IN subquery makes every comparison unknown, so eligible rows disappear.",
          "id": "c008",
          "line": 20,
          "path": "db/report.sql",
          "severity": "bug",
          "title": "Nullable exclusion list empties the result"
        }
      ],
      "group_id": "g004",
      "pairs": [
        {
          "candidate_id": "c008",
          "pair_id": "p004",
          "reference_id": "r007"
        }
      ],
      "reference_findings": [
        {
          "detail": "SQL three-valued logic makes the predicate unknown for all candidates when a NULL appears.",
          "id": "r007",
          "line": 10,
          "path": "db/report.sql",
          "severity": "bug",
          "title": "NOT IN rejects every row when the subquery contains NULL"
        }
      ],
      "stratum": "equivalent-paraphrase"
    },
    {
      "candidate_findings": [
        {
          "detail": "The focused link's outline extends beyond the card and is hidden by the new overflow rule.",
          "id": "c010",
          "line": 20,
          "path": "src/card.css",
          "severity": "risk",
          "title": "Keyboard focus indicator is not visible"
        }
      ],
      "group_id": "g005",
      "pairs": [
        {
          "candidate_id": "c010",
          "pair_id": "p005",
          "reference_id": "r009"
        }
      ],
      "reference_findings": [
        {
          "detail": "overflow: hidden on the card cuts off the keyboard focus outline.",
          "id": "r009",
          "line": 10,
          "path": "src/card.css",
          "severity": "risk",
          "title": "Focus ring is clipped"
        }
      ],
      "stratum": "equivalent-paraphrase"
    },
    {
      "candidate_findings": [
        {
          "detail": "The audit insert runs after commit and cannot roll back the state change when it fails.",
          "id": "c012",
          "line": 20,
          "path": "src/account.cs",
          "severity": "bug",
          "title": "Commit can succeed without its audit row"
        }
      ],
      "group_id": "g006",
      "pairs": [
        {
          "candidate_id": "c012",
          "pair_id": "p006",
          "reference_id": "r011"
        }
      ],
      "reference_findings": [
        {
          "detail": "The transaction commits before the audit record is inserted, so audit failure leaves an untracked update.",
          "id": "r011",
          "line": 10,
          "path": "src/account.cs",
          "severity": "bug",
          "title": "Audit write is outside the transaction"
        }
      ],
      "stratum": "equivalent-paraphrase"
    },
    {
      "candidate_findings": [
        {
          "detail": "Expired access tokens remain in the process cache and can be reused after their expiry.",
          "id": "c014",
          "line": 20,
          "path": "src/auth.ts",
          "severity": "bug",
          "title": "Token cache ignores expiration"
        }
      ],
      "group_id": "g007",
      "pairs": [
        {
          "candidate_id": "c014",
          "pair_id": "p007",
          "reference_id": "r013"
        }
      ],
      "reference_findings": [
        {
          "detail": "The endpoint accepts a valid token without requiring the invoices.write scope.",
          "id": "r013",
          "line": 10,
          "path": "src/auth.ts",
          "severity": "bug",
          "title": "Authorization scope is not checked"
        }
      ],
      "stratum": "related-distinct"
    },
    {
      "candidate_findings": [
        {
          "detail": "Accessing the navigation property inside the loop creates an N+1 query pattern.",
          "id": "c016",
          "line": 20,
          "path": "src/Orders.cs",
          "severity": "risk",
          "title": "Loop issues one query per row"
        }
      ],
      "group_id": "g008",
      "pairs": [
        {
          "candidate_id": "c016",
          "pair_id": "p008",
          "reference_id": "r015"
        }
      ],
      "reference_findings": [
        {
          "detail": "A read-only query omits AsNoTracking and grows the change tracker.",
          "id": "r015",
          "line": 10,
          "path": "src/Orders.cs",
          "severity": "risk",
          "title": "Query materializes tracked entities"
        }
      ],
      "stratum": "related-distinct"
    },
    {
      "candidate_findings": [
        {
          "detail": "The effect registers a window listener but its cleanup does not remove it.",
          "id": "c018",
          "line": 20,
          "path": "src/Profile.tsx",
          "severity": "bug",
          "title": "Component leaks a resize listener"
        }
      ],
      "group_id": "g009",
      "pairs": [
        {
          "candidate_id": "c018",
          "pair_id": "p009",
          "reference_id": "r017"
        }
      ],
      "reference_findings": [
        {
          "detail": "Random IDs generated during render cause a hydration mismatch.",
          "id": "r017",
          "line": 10,
          "path": "src/Profile.tsx",
          "severity": "bug",
          "title": "Server and client render different IDs"
        }
      ],
      "stratum": "related-distinct"
    },
    {
      "candidate_findings": [
        {
          "detail": "The workload identity is never granted secret read access.",
          "id": "c020",
          "line": 20,
          "path": "infra/main.tf",
          "severity": "bug",
          "title": "Role lacks permission to read the secret"
        }
      ],
      "group_id": "g010",
      "pairs": [
        {
          "candidate_id": "c020",
          "pair_id": "p010",
          "reference_id": "r019"
        }
      ],
      "reference_findings": [
        {
          "detail": "The hard-coded endpoint fails in sovereign cloud partitions.",
          "id": "r019",
          "line": 10,
          "path": "infra/main.tf",
          "severity": "bug",
          "title": "Deployment assumes the commercial-cloud endpoint"
        }
      ],
      "stratum": "related-distinct"
    },
    {
      "candidate_findings": [
        {
          "detail": "The new reset removes outline without supplying an alternate focus indicator.",
          "id": "c022",
          "line": 20,
          "path": "src/dialog.css",
          "severity": "risk",
          "title": "Button has no visible keyboard focus"
        }
      ],
      "group_id": "g011",
      "pairs": [
        {
          "candidate_id": "c022",
          "pair_id": "p011",
          "reference_id": "r021"
        }
      ],
      "reference_findings": [
        {
          "detail": "The overlay's stacking context covers the button and receives pointer events.",
          "id": "r021",
          "line": 10,
          "path": "src/dialog.css",
          "severity": "risk",
          "title": "Overlay intercepts button clicks"
        }
      ],
      "stratum": "related-distinct"
    },
    {
      "candidate_findings": [
        {
          "detail": "A timeout followed by retry can create the order twice because no idempotency key is sent.",